SCENENAME,SPEAKER_ORDER,SPEAKER_1,TEXT_1,SPEAKER_2,TEXT_2,SPEAKER_3,TEXT_3,SPEAKER_4,TEXT_4
intro,"hero,hero,meena,meena,hero",hero,Sigh.*I hope tomorrow school is less awful than today.*[SPEAKER_2]*Oh no!*[SPEAKER_2],meena,There she is!*[SPEAKER_1]*Get that freak!,,,,
intro2,"meena,hero,meena",meena,"She went this way!*[SPEAKER_2]*What are you running from? Are you scared, little baby??",hero,"Oh gosh, oh gosh, oh gosh!*[SPEAKER_1]",,,,
forest_arrival,hero,hero,Where am I? Where did Meena go?*Wasn't she right behind me?,,,,,,
forest_arrival_midpoint,hero,hero,I don't recognize this part of the park at all!*And why is everything so quiet?,,,,,,
castle_arrival,hero,hero,What the heck is that??,,,,,,
castle_entrance,hero,hero,This place is creepy. But also cool.,,,,,,
castle_throne_room,"hero,king",hero,Whoa! Look at all this stuff! And that skeleton is so creepy!*I like it!*Cooooool. That crown looks awesome.*Hmmm. Is this really gold?*[SPEAKER_2]*Aaaahhhhg!*[SPEAKER_2]*You're a ggggÄghost??*[SPEAKER_2]*Before? That's not possible! I don't even know where I am!*[SPEAKER_2]*Where else could I be? There are NO castles in my neighborhood.*[SPEAKER_2]*Wait. Did you say something about being cursed?*[SPEAKER_2]*This land? What ARE you talking about? This isn't Paxton City?*[SPEAKER_2]*I am so confused. I want to go home.*[SPEAKER_2]*What??,king,"Of course it is gold!*[SPEAKER_1]*But you really should not take things that don't belong to you.*Especially when they are cursed.*[SPEAKER_1]*I, young lady, am King Elendore. Or least, I once was.*You look familiar. Have I seen you before?*[SPEAKER_1]*How could you not know where you are? Where else is there to be?*[SPEAKER_1]*Neighborhood? You speak strangely.*[SPEAKER_1]*Ah, yes. That. Yes this whole land is cursed. It has been so for ages.*[SPEAKER_1]*I do not know anything of this Paxton City you refer to. This is, or was actually, the kingdom of Daiya*[SPEAKER_1]*Hmmm. The hour is getting late. The sun is setting. It is not safe to be in the forest after dark. You shall have to stay here until morning.*[SPEAKER_1]*There is nothing that can be done. You can stay in what was once my daughter's room. We shall talk more in the morning.",,,,
princess_room,hero,hero,What is going on??*I want to go hooooommme.*Whaaaugh!*Sniff!!,,,,,,